name	friendly_name	install_dir	download_url	ckan_name	status
TweakScaleCompanion_NFS	TweakScale Companion for Near Future Solar	GameDatabase::TweakScaleCompanion::NFS	https://github.com/net-lisias-ksp/TweakScaleCompanion_NF/releases		deprecated
TweakScaleCompanion_NF	TweakScale Companion for Near Future Add’ons	GameDatabase::TweakScaleCompanion::NF	https://github.com/net-lisias-ksp/TweakScaleCompanion_NF/releases		beta
TweakScaleCompanion_KIS	TweakScale Companion for KIS	GameDatabase::TweakScaleCompanion::KIS	https://github.com/net-lisias-ksp/TweakScaleCompanion_KIS/releases		alpha
TweakScaleCompanion_SMCE	TweakScale Companion for SMCE (SpannerMonkey)	GameDatabase::TweakScaleCompanion::SMCE	https://github.com/net-lisias-ksp/TweakScaleCompanion_SMCE/releases		beta
TweakScaleCompanion_ReStockPlus	TweakScale Companion for ReStockPlus	GameDatabase::TweakScaleCompanion::ReStockPlus	https://github.com/net-lisias-ksp/TweakScaleCompanion_ReStockPlus/releases		stable
TweakScaleCompanion_FS	TweakScale Companion for Firespitter	GameDatabase::TweakScaleCompanion::FS	https://github.com/net-lisias-ksp/FS/releases		alpha
TweakScaleCompanion_APlus	TweakScale Companion for Airplane Plus	GameDatabase::TweakScaleCompanion::APlus	https://github.com/net-lisias-ksp/TweakScaleCompanion_APlus/releases		beta
